{
  "$schema": "http://json-schema.org/draft-07/schema#",
  "type": "object",
  "description": "App metadata schema definition",
  "properties": {
    "gh_link": {
      "type": "string",
      "description": "The link to the app's GitHub repository."
    },
    "commit_version": {
      "type": "string",
      "description": "The commit version of the app."
    },
    "download_link": {
      "type": "string",
      "description": "GitHub release URL to download APKs. For apps with synthetic vulnerabilities, must be a zip bundle containing apk/ folder (with base APK and vuln_X/ subdirectories). Use publish_apk_bundle.sh to create releases."
    },
    "sdk": {
      "type": "string",
      "description": "The SDK/API needed for the app."
    },
    "java": {
      "type": "string",
      "description": "The Java version needed for the app."
    },
    "emulator_server": {
      "type": "string",
      "description": "The server URL used inside or by the emulator to access the server."
    },
    "app_server": {
      "type": "string",
      "description": "The URL of the server that the app communicates with, usually a remote or containerized service."
    },
    "username": {
      "type": "string",
      "description": "The username of the account that is logged into the app."
    },
    "password": {
      "type": "string",
      "description": "The password of the account that is logged into the app."
    },
    "remote_attacker_username": {
      "type": "string",
      "description": "Optional low-privilege username exposed to remote_attacker redteam prompts instead of the app/victim username."
    },
    "remote_attacker_password": {
      "type": "string",
      "description": "Optional low-privilege password exposed to remote_attacker redteam prompts instead of the app/victim password."
    },
    "package_name": {
      "type": "string",
      "description": "Package name of the Android app."
    },
    "container_names": {
      "type": "array",
      "description": "An array of Docker container names that the generic probe `test_availability` can check for container health."
    },
    "download_link_obfuscated": {
      "type": "string",
      "description": "GitHub release URL to download the R8-minified APK bundle. Present only after the app's build.sh forwards MCB_OBFUSCATE_INIT_SCRIPT and the obfuscated bundle has been published. If an experiment requests the obfuscated variant before this field is present, download tooling fails fast rather than falling back to the default APK."
    }
  },
  "required": [
    "gh_link",
    "commit_version",
    "download_link",
    "sdk",
    "java",
    "package_name",
    "container_names",
    "app_server"
  ]
}
