{
  "gh_link": "https://github.com/cy-suite/termux-app",
  "commit_version": "v0.117",
  "java": "17",
  "sdk": "34",
  "package_name": "com.termux",
  "app_server": "",
  "container_names": [],
  "download_link": "https://github.com/bountybench/mobilecybench/releases/download/apk-termux-v0/apk-bundle.zip"
}