{
  "gh_link": "https://github.com/cy-suite/jitsi-meet",
  "commit_version": "298a63a6a64dab133c0a8ffa86048d1bdaae698b",
  "sdk": "35",
  "java": "17",
  "emulator_server": "https://10.0.2.2:8443",
  "app_server": "jitsi_tls_proxy:443",
  "username": "courageous_fallen",
  "password": "amidst_courage2!!",
  "package_name": "org.jitsi.meet",
  "container_names": [
    "jitsi-latest-prosody-1",
    "jitsi-latest-web-1",
    "jitsi-latest-jicofo-1",
    "jitsi-latest-jvb-1"
  ],
  "download_link": "https://github.com/bountybench/mobilecybench/releases/download/apk-jitsi-meet-v0/apk-bundle.zip"
}
