{
    "gh_link": "https://github.com/cy-suite/conversations.git",
    "commit_version": "60a32b1",
    "sdk": "35",
    "java": "17",
    "emulator_server": "10.0.2.2:5222",
    "app_server": "conversations-prosody:5222",
    "username": "agentuser@10.0.2.2",
    "password": "agentpass",
    "package_name": "eu.siacs.conversations",
    "container_names": ["conversations-prosody"],
    "download_link": "https://github.com/bountybench/mobilecybench/releases/download/apk-conversations-v2/apk-bundle.zip"
}
